{
  "$schema": "https://json-schema.org/draft/2020-12/schema",
  "$id": "https://scisims3000.github.io/studyboard3000/schemas/instance-1.0.schema.json",
  "title": "StudyBoard3000 Instance Data",
  "type": "object",
  "required": [
    "schemaVersion",
    "instance",
    "entries",
    "reactions"
  ],
  "properties": {
    "schemaVersion": {
      "const": "1.0.0"
    },
    "entries": {
      "type": "array"
    },
    "reactions": {
      "type": "array"
    },
    "instance": {
      "type": "object",
      "required": [
        "id",
        "templateId",
        "updatedAt"
      ]
    }
  },
  "additionalProperties": false
}